{
  "case": "PR-322",
  "variant": "loglog_zero_x",
  "suite": "plain_read",
  "schema_version": "0.1.0",
  "inputs": {
    "records": [
      "shear_thinning_loglog_zero_x.json"
    ]
  },
  "request": {
    "target": {
      "record": {
        "id": "conformance/shear_thinning_fixture",
        "version": "1.0.0",
        "content_hash": "sha256:29b8225ceaa15d9242bcffe47cb7eecc1c224b9eeb21b71e2ab29465bf18080a"
      },
      "field": "fluid.dynamic_viscosity"
    },
    "operating_conditions": {
      "temperature": {
        "value": 310.15,
        "unit": "K"
      },
      "shear_rate": {
        "value": 50.0,
        "unit": "1/s"
      }
    },
    "requirement": {
      "want": "value",
      "conditions": {
        "temperature": {
          "tolerance": {
            "value": 1.0,
            "unit": "K"
          }
        }
      }
    }
  },
  "expected": {
    "status": "not_met",
    "reasons": [
      {
        "code": "form_invalid"
      }
    ],
    "labels": []
  },
  "compare": {
    "members": [
      "status",
      "reasons",
      "value",
      "alternative_values",
      "unit",
      "conditions",
      "specimen",
      "statistics",
      "provenance",
      "labels",
      "assumption"
    ]
  }
}
