{
  "case": "PR-002",
  "variant": "overlay_base_not_object",
  "suite": "plain_read",
  "schema_version": "0.1.0",
  "inputs": {
    "records": [
      "overlay_base_not_object.json"
    ]
  },
  "request": {
    "target": {
      "record": {
        "id": "conformance/water_overlay_fixture",
        "version": "1.0.0",
        "content_hash": "sha256:777bfa7daf09a503336fb9906279751362a95ace692a6f61d653319ebda565cf"
      },
      "field": "fluid.dynamic_viscosity"
    },
    "operating_conditions": {
      "temperature": {
        "value": 310.15,
        "unit": "K"
      }
    },
    "requirement": {
      "want": "value",
      "conditions": {
        "temperature": {
          "tolerance": {
            "value": 1.0,
            "unit": "K"
          }
        }
      }
    }
  },
  "expected": {
    "status": "not_met",
    "reasons": [
      {
        "code": "malformed"
      }
    ]
  },
  "compare": {
    "members": [
      "status",
      "reasons",
      "value"
    ]
  }
}
