{
  "case": "HS-011",
  "variant": "stated_differs_recomputed_equals",
  "suite": "hash",
  "schema_version": "0.1.0",
  "claims": {
    "hash": true
  },
  "inputs": {
    "records": [
      "water_fixture_value_edited.json"
    ]
  },
  "request": {
    "target": {
      "record": {
        "id": "conformance/water_fixture",
        "version": "1.0.0",
        "content_hash": "sha256:8fd887d712c2afefe7291b2028df5ea03048c21f8e989c7517d439ad96a1871b"
      },
      "field": "fluid.dynamic_viscosity"
    },
    "operating_conditions": {
      "temperature": {
        "value": 310.15,
        "unit": "K"
      }
    },
    "requirement": {
      "want": "value",
      "conditions": {
        "temperature": {
          "tolerance": {
            "value": 1.0,
            "unit": "K"
          }
        }
      }
    }
  },
  "expected": {
    "status": "not_met",
    "reasons": [
      {
        "code": "pin_mismatch"
      }
    ],
    "labels": []
  },
  "compare": {
    "members": [
      "status",
      "reasons",
      "value",
      "labels"
    ]
  }
}
