{
  "case": "PR-320",
  "variant": "operating_unit_trailing_space",
  "suite": "plain_read",
  "schema_version": "0.1.0",
  "inputs": {
    "records": [
      "water_fixture.json"
    ]
  },
  "request": {
    "target": {
      "record": {
        "id": "conformance/water_fixture",
        "version": "1.0.0",
        "content_hash": "sha256:f0216df7e6d753390e2f8a185f3aa553ec5c9435c2a97fa70de5a82388dde5d6"
      },
      "field": "fluid.dynamic_viscosity"
    },
    "operating_conditions": {
      "temperature": {
        "value": 310.15,
        "unit": "K "
      }
    },
    "requirement": {
      "want": "value",
      "conditions": {
        "temperature": {
          "tolerance": {
            "value": 1.0,
            "unit": "K"
          }
        }
      }
    }
  },
  "expected": {
    "status": "not_met",
    "reasons": [
      {
        "code": "request_unit_mismatch",
        "condition": "temperature"
      }
    ]
  },
  "compare": {
    "members": [
      "status",
      "reasons",
      "value"
    ]
  }
}
