{
  "case": "PR-002",
  "variant": "truncated_utf8",
  "suite": "plain_read",
  "schema_version": "0.1.0",
  "inputs": {
    "records": [
      "water_fault_truncated_utf8.json"
    ]
  },
  "request": {
    "target": {
      "record": {
        "id": "conformance/water_fixture",
        "version": "1.0.0",
        "content_hash": "sha256:c21a2c7f46e66bcfb5e74f18d2a08644468d5a92bafb4fa57a03651facf96e2d"
      },
      "field": "fluid.dynamic_viscosity"
    },
    "operating_conditions": {
      "temperature": {
        "value": 310.15,
        "unit": "K"
      }
    },
    "requirement": {
      "want": "value",
      "conditions": {
        "temperature": {
          "tolerance": {
            "value": 1.0,
            "unit": "K"
          }
        }
      }
    }
  },
  "expected": {
    "status": "not_met",
    "reasons": [
      {
        "code": "malformed"
      }
    ]
  },
  "compare": {
    "members": [
      "status",
      "reasons",
      "value"
    ]
  }
}
