{
  "case": "PR-330",
  "variant": "overlay_acceptance_without_overlay",
  "suite": "plain_read",
  "schema_version": "0.1.0",
  "inputs": {
    "records": [
      "density_alternatives_outside_met_unstated.json"
    ]
  },
  "request": {
    "target": {
      "record": {
        "id": "conformance/density_alternatives_fixture",
        "version": "1.0.0",
        "content_hash": "sha256:5daade187d37d7c417fbefa3d6fb08c9bffa9e5242d2a6c5144c5c0a485f74ae"
      },
      "field": "bulk.density"
    },
    "operating_conditions": {
      "temperature": {
        "value": 310.0,
        "unit": "K"
      }
    },
    "requirement": {
      "want": "value",
      "conditions": {
        "temperature": {
          "tolerance": {
            "value": 1.0,
            "unit": "K"
          }
        },
        "density_kind": {
          "accept": [
            "apparent"
          ]
        }
      }
    },
    "acceptances": [
      {
        "acceptance": "overlay",
        "field": "bulk.density",
        "reason": "conformance fixture: an illustrative reason"
      }
    ]
  },
  "expected": {
    "status": "not_met",
    "reasons": [
      {
        "code": "request_incomplete"
      }
    ],
    "labels": []
  },
  "compare": {
    "members": [
      "status",
      "reasons",
      "value",
      "alternative_values",
      "unit",
      "conditions",
      "specimen",
      "statistics",
      "provenance",
      "labels",
      "assumption"
    ]
  }
}
