{
  "case": "PR-338",
  "variant": "nominal_other_hash",
  "suite": "plain_read",
  "schema_version": "0.1.0",
  "inputs": {
    "records": [
      "grade_density_bounds_specification_limits.json"
    ]
  },
  "request": {
    "target": {
      "record": {
        "id": "conformance/polymer_grade_fixture",
        "version": "1.0.0",
        "content_hash": "sha256:2dd13cc5a0a9abb5e910892f9ca7403866e4492f32d7f4dc8b0af86be493dc97"
      },
      "field": "bulk.density"
    },
    "operating_conditions": {
      "temperature": {
        "value": 293.15,
        "unit": "K"
      }
    },
    "requirement": {
      "want": "value",
      "conditions": {
        "temperature": {
          "tolerance": {
            "value": 1.0,
            "unit": "K"
          }
        },
        "density_kind": {
          "accept": [
            "apparent"
          ]
        }
      }
    },
    "acceptances": [
      {
        "acceptance": "nominal",
        "record": {
          "id": "conformance/polymer_grade_fixture",
          "version": "1.0.0",
          "content_hash": "sha256:ecb99a61ea6cc2f7096572d8e87a5bfaa8a1148d5bfb2693e0ae48c4c203e53f"
        },
        "field": "bulk.density",
        "value": 1200.0,
        "basis": "conformance fixture: the midpoint of the limits",
        "reason": "conformance fixture: an illustrative reason"
      }
    ]
  },
  "expected": {
    "status": "not_met",
    "reasons": [
      {
        "code": "want_mismatch"
      }
    ],
    "conditions": [
      {
        "name": "temperature",
        "status": "met",
        "record": {
          "value": 293.15,
          "unit": "K",
          "basis": "stated"
        },
        "operating": {
          "value": 293.15,
          "unit": "K"
        }
      },
      {
        "name": "density_kind",
        "status": "met",
        "record": {
          "token": "apparent",
          "basis": "stated"
        }
      }
    ],
    "labels": []
  },
  "compare": {
    "members": [
      "status",
      "reasons",
      "value",
      "alternative_values",
      "unit",
      "conditions",
      "specimen",
      "statistics",
      "provenance",
      "labels",
      "assumption"
    ],
    "exact": true
  }
}
