{
  "case": "PR-042",
  "variant": "fit_over_withheld",
  "suite": "plain_read",
  "schema_version": "0.1.0",
  "inputs": {
    "records": [
      "reference_only.json",
      "fit_overlay_on_reference_only.json"
    ]
  },
  "request": {
    "target": {
      "record": {
        "id": "conformance/reference_only_fixture",
        "version": "1.0.0",
        "content_hash": "sha256:e97cba8d32678d3835a9c77daa24bf8bf5d01585145157169b0480087abf34b0"
      },
      "field": "fluid.dynamic_viscosity"
    },
    "operating_conditions": {
      "temperature": {
        "value": 310.15,
        "unit": "K"
      },
      "shear_rate": {
        "value": 100.0,
        "unit": "1/s"
      }
    },
    "requirement": {
      "want": "value",
      "conditions": {
        "temperature": {
          "tolerance": {
            "value": 1.0,
            "unit": "K"
          }
        },
        "shear_rate": {
          "tolerance": {
            "value": 0.0,
            "unit": "1/s"
          }
        }
      }
    },
    "acceptances": [
      {
        "acceptance": "overlay",
        "field": "fluid.dynamic_viscosity",
        "overlay": {
          "id": "conformance/fit_overlay_fixture",
          "version": "1.0.0",
          "content_hash": "sha256:1cc48485c3355ef6771db29cb343cf71cc094e7ac2bc3e4d03971e2543a58064"
        },
        "reason": "conformance fixture: an illustrative reason"
      }
    ]
  },
  "expected": {
    "status": "not_met",
    "reasons": [
      {
        "code": "withheld"
      }
    ],
    "labels": []
  },
  "compare": {
    "members": [
      "status",
      "reasons",
      "value",
      "alternative_values",
      "unit",
      "conditions",
      "specimen",
      "statistics",
      "provenance",
      "labels",
      "assumption"
    ]
  }
}
