{
  "case": "TE-007",
  "variant": "one_point_range_end",
  "suite": "table_evaluation",
  "schema_version": "0.1.0",
  "inputs": {},
  "request": {
    "operation": "evaluate",
    "form": "table",
    "table": {
      "axis": "temperature",
      "axis_unit": "K",
      "x": [
        280.0,
        300.0,
        320.0,
        340.0
      ],
      "y": [
        1000.0,
        996.0,
        990.0,
        986.0
      ],
      "scheme": "linear",
      "edges": [],
      "source_range": [
        340.0,
        400.0
      ]
    },
    "at": [
      340.0,
      330.0,
      350.0
    ]
  },
  "expected": {
    "evaluations": [
      {
        "in_range": true,
        "value": 986.0,
        "derivative": "none"
      },
      {
        "in_range": false,
        "value": 986.0,
        "derivative": 0.0
      },
      {
        "in_range": false,
        "value": 986.0,
        "derivative": 0.0
      }
    ]
  },
  "compare": {
    "members": [
      "evaluations"
    ],
    "relative_tolerance": {
      "binary64": 1e-12,
      "binary32": 3e-07
    }
  }
}
