{
  "case": "PR-006",
  "variant": "number_source_not_listed",
  "suite": "plain_read",
  "schema_version": "0.1.0",
  "inputs": {
    "records": [
      "glycerol_fixture.json",
      "source_number.json"
    ]
  },
  "request": {
    "operation": "list_records"
  },
  "expected": {
    "status": "met",
    "reasons": [],
    "value": [
      {
        "id": "conformance/glycerol_fixture",
        "version": "1.0.0"
      }
    ]
  },
  "compare": {
    "members": [
      "status",
      "reasons",
      "value"
    ]
  }
}
